video_id,title,description,published_at,tags,hashtags,duration,view_count,like_count,comment_count
fIBdff3iIcs,うどん作りは絶対に見ていてほしいねこ。-Maru definitely wants me to watch him when he's making udon.-,お魚のおもちゃで遊ぶはな＆みりと、枕にしちゃうまるさん。そしてうどん作りは絶対に見ていてほしいまるさん！ Hana&Miri play with the fish toy and he uses it as a pillow. And Maru definitely wants me to watch him when he's making udon!  このチャンネルのメンバーになって特典にアクセスしてください: https://www.youtube.com/channel/UCRVruzlQF5cqpw9jQgIgNdw/join  #猫 #まる #cats,2025-05-16T12:01:15Z,まる|猫動画|I am Maru|私信まる|Maru|スコティッシュ,#猫|#まる|#cats,PT6M7S,40745,2788,110
vcsUOrNFAKw,最後の1滴まで美しく液体になるねこ。 #Shorts,最後の1滴まで美しく液体になるまるさん。Maru becomes beautifully liquid until the last drop.  このチャンネルのメンバーになって特典にアクセスしてください: https://www.youtube.com/channel/UCRVruzlQF5cqpw9jQgIgNdw/join  #猫は液体 #まる #cats,2025-05-12T06:21:32Z,まる|猫動画|I am Maru|私信まる|Maru|スコティッシュ,#猫は液体|#まる|#cats,PT49S,50481,4204,118
EGECs71ltq4,知育トイチャレンジなねこ。-Educational Toy Challenge and Cats.-,"知育トイにチャレンジするまる・はな・みり。経験値が高いまるさんには、ノーレクチャーで参加してもらいました！ Maru&Hana&Miri challenged themselves with the Educational Toy. Maru had a lot of experience, so he tried without a guide.   このチャンネルのメンバーになって特典にアクセスしてください: https://www.youtube.com/channel/UCRVruzlQF5cqpw9jQgIgNdw/join  #猫 #まる #cats",2025-05-10T12:00:32Z,まる|猫動画|I am Maru|私信まる|Maru|スコティッシュ,#猫|#まる|#cats,PT10M18S,60725,3605,218
3SbSqy5oVxo,入った穴から出られないねこ！？。 #Shorts,入った穴から出られないまるさん！？　Maru cannot get out of the hole he entered through!?  ★まるさん初のエッセイ本が発売になりました！ 　Maru's  first essay book is released! (Japanese only) ★楽天： https://books.rakuten.co.jp/rb/18146374/?msockid=1b8dbfce97f2697f14fcae1c9618688a ★Amazon: https://amzn.asia/d/fHGKhVb ★双葉社：https://www.futabasha.co.jp/book/97845753196680000000?type=1 #猫 #まる #cats,2025-05-07T04:32:41Z,まる|猫動画|I am Maru|私信まる|Maru|スコティッシュ,#猫|#まる|#cats,PT1M4S,57853,3723,129
nofEL-QNIB4,春のサラダバーを満喫するねこ。-Cats enjoy the spring salad bar.-,天然のサラダバーがオープンしました！　のんびり春のサラダバーを楽しむまるさんとはなとみり。　The natural salad bar has opened! Maru&Hana&Miri leisurely enjoy the spring salad bar.  ★まるさん初のエッセイ本が発売になりました！ 　Maru's  first essay book is released! (Japanese only) ★楽天： https://books.rakuten.co.jp/rb/18146374/?msockid=1b8dbfce97f2697f14fcae1c9618688a ★Amazon: https://amzn.asia/d/fHGKhVb ★双葉社：https://www.futabasha.co.jp/book/97845753196680000000?type=1 #猫 #まる #cats,2025-05-05T12:01:32Z,まる|猫動画|I am Maru|私信まる|Maru|スコティッシュ,#猫|#まる|#cats,PT6M14S,64067,3473,178
ErlKk6ynBbo,蒸しタオルで美しさを保つねこ。 #Shorts,蒸しタオルで美しさを保つまるさん。Maru keeps his beauty in a steamed towel.  ★まるさん初のエッセイ本が発売になりました！ 　Maru's  first essay book is released! (Japanese only) ★楽天： https://books.rakuten.co.jp/rb/18146374/?msockid=1b8dbfce97f2697f14fcae1c9618688a ★Amazon: https://amzn.asia/d/fHGKhVb ★双葉社：https://www.futabasha.co.jp/book/97845753196680000000?type=1 #猫 #まる #cats,2025-05-03T05:29:48Z,まる|猫動画|I am Maru|私信まる|Maru|スコティッシュ,#猫|#まる|#cats,PT49S,92815,6413,171
